Sheet: Лист1
B1: Année | C1: Nb. étapes | D1: Distance parcourue | E1: Temps du vainqueur | F1: Moyenne horaire (km/h) | G1: Vainqueur | H1: nationalite | I1: birthday
B2: 1903 | C2: 6 | D2: 2428 | E2: =RC[-1]/RC[1] -> 94.551968534600263 | F2: 25.678999999999998 | G2: Maurice GARIN | H2: FR | I2: 03/03/1871
B3: 1904 | C3: 6 | D3: 2428 | E3: =RC[-1]/RC[1] -> 96.101325944983174 | F3: 25.265000000000001 | G3: Henri CORNET | H3: FR | I3: 05/08/1884
B4: 1905 | C4: 11 | D4: 2994 | E4: =RC[-1]/RC[1] -> 110.45117497325414 | F4: 27.106999999999999 | G4: Louis TROUSSELIER | H4: FR | I4: 29/06/1881
B5: 1906 | C5: 13 | D5: 4545 | E5: =RC[-1]/RC[1] -> 185.79078608510812 | F5: 24.463000000000001 | G5: René POTTIER | H5: FR | I5: 05/06/1879
B6: 1907 | C6: 14 | D6: 4488 | E6: =RC[-1]/RC[1] -> 157.6396206533193 | F6: 28.47 | G6: Lucien MAZAN | H6: FR | I6: 18/10/1882
B7: 1908 | C7: 14 | D7: 4488 | E7: =RC[-1]/RC[1] -> 156.15866388308979 | F7: 28.74 | G7: Lucien MAZAN | H7: FR | I7: 18/10/1882
B8: 1909 | C8: 14 | D8: 4497 | E8: =RC[-1]/RC[1] -> 156.91953381254797 | F8: 28.658000000000001 | G8: François FABER | H8: FR | I8: 26/01/1887
B9: 1910 | C9: 15 | D9: 4734 | E9: =RC[-1]/RC[1] -> 162.68600295542802 | F9: 29.099 | G9: Octave LAPIZE | H9: FR | I9: 24/10/1887
B10: 1911 | C10: 15 | D10: 5343 | E10: =RC[-1]/RC[1] -> 195.55669423907474 | F10: 27.321999999999999 | G10: Gustave GARRIGOU | H10: FR | I10: 24/09/1884
B11: 1912 | C11: 15 | D11: 5289 | E11: =RC[-1]/RC[1] -> 190.50534884558584 | F11: 27.763000000000002 | G11: Odiel DEFRAEYE | H11: BEL | I11: 14/07/1888
B12: 1913 | C12: 15 | D12: 5287 | E12: =RC[-1]/RC[1] -> 197.90379936365338 | F12: 26.715 | G12: Philippe THYS | H12: BEL | I12: 08/10/1889
B13: 1914 | C13: 15 | D13: 5380 | E13: =RC[-1]/RC[1] -> 200.4844419601267 | F13: 26.835000000000001 | G13: Philippe THYS | H13: BEL | I13: 08/10/1889
B14: 1919 | C14: 15 | D14: 5560 | E14: =RC[-1]/RC[1] -> 231.12736947123378 | F14: 24.056000000000001 | G14: Firmin LAMBOT | H14: BEL | I14: 14/03/1886
B15: 1920 | C15: 15 | D15: 5503 | E15: =RC[-1]/RC[1] -> 228.60584911930874 | F15: 24.071999999999999 | G15: Philippe THYS | H15: BEL | I15: 08/10/1889
B16: 1921 | C16: 15 | D16: 5485 | E16: =RC[-1]/RC[1] -> 221.84921533732407 | F16: 24.724 | G16: Léon SCIEUR | H16: BEL | I16: 19/03/1888
B17: 1922 | C17: 15 | D17: 5375 | E17: =RC[-1]/RC[1] -> 222.1441560588527 | F17: 24.196000000000002 | G17: Firmin LAMBOT | H17: BEL | I17: 14/03/1886
B18: 2003 | C18: 20 | D18: 3427 | E18: =RC[-1]/RC[1] -> 83.707865168539328 | F18: 40.94 | G18: No winner | H18: No winner | I18: 1903-01-01T00:00:00.000
B19: 2004 | C19: 20 | D19: 3391 | E19: =RC[-1]/RC[1] -> 83.625154130702839 | F19: 40.549999999999997 | G19: No winner | H19: No winner | I19: 1903-01-01T00:00:00.000
B20: 2005 | C20: 21 | D20: 3593 | E20: =RC[-1]/RC[1] -> 86.266506602641059 | F20: 41.65 | G20: No winner | H20: No winner | I20: 1903-01-01T00:00:00.000
B21: 2006 | C21: 20 | D21: 3657 | E21: =RC[-1]/RC[1] -> 89.676311917606668 | F21: 40.78 | G21: Oscar PEREIRO SIO | H21: ESP | I21: 1977-08-03T00:00:00.000
B22: 2007 | C22: 20 | D22: 3570 | E22: =RC[-1]/RC[1] -> 91.024987251402351 | F22: 39.22 | G22: Alberto CONTADOR | H22: ESP | I22: 1982-12-06T00:00:00.000
B23: 2008 | C23: 21 | D23: 3560 | E23: =RC[-1]/RC[1] -> 87.922943936774502 | F23: 40.49 | G23: Carlos SASTRE | H23: ESP | I23: 1975-04-22T00:00:00.000
B24: 2009 | C24: 21 | D24: 3460 | E24: =RC[-1]/RC[1] -> 85.834780451500862 | F24: 40.31 | G24: Alberto CONTADOR | H24: ESP | I24: 1982-12-06T00:00:00.000
B25: 2010 | C25: 20 | D25: 3642 | E25: =RC[-1]/RC[1] -> 91.992927506946188 | F25: 39.590000000000003 | G25: Andy SCHLECK | H25: LUX | I25: 1985-06-10T00:00:00.000
B26: 2011 | C26: 21 | D26: 3630 | E26: =RC[-1]/RC[1] -> 91.251885369532431 | F26: 39.78 | G26: Cadel EVANS | H26: AUS | I26: 1977-02-14T00:00:00.000
B27: 2012 | C27: 20 | D27: 3497 | E27: =RC[-1]/RC[1] -> 87.688064192577727 | F27: 39.880000000000003 | G27: Bradley WIGGINS | H27: GB | I27: 1980-04-28T00:00:00.000
B28: 2013 | C28: 21 | D28: 3404 | E28: =RC[-1]/RC[1] -> 83.944444444444443 | F28: =RC[-2]/(83+56/60+40/3600) -> 40.550628722700196 | G28: Christopher FROOME | H28: GB | I28: 1985-05-20T00:00:00.000